{
  "schema_version": "1.0",
  "model_id": "gpt-oss-20b",
  "ollama_tag": "gpt-oss:20b",
  "runtime": {
    "engine": "ollama",
    "version": "0.40.3"
  },
  "gpu": {
    "name": "Tesla T4",
    "vram_gb": 15.0,
    "driver": "580.178.04",
    "cuda": "",
    "profile_id": "t4-16"
  },
  "quant": "MXFP4",
  "context": 4096,
  "metrics": {
    "load_s": 95.51,
    "ttft_ms": 63.4,
    "prompt_tps": 1528.8,
    "gen_tps": 49.78,
    "gen_tps_runs": [
      14.91,
      50.43,
      49.78
    ],
    "peak_vram_gb": 6.82,
    "output_tokens": 768
  },
  "run": {
    "date": "2026-10-12",
    "prompt_id": "fitlab-v1-256",
    "repetitions": 3,
    "duration_s": 246.5
  },
  "provenance": {
    "source": "ci-kaggle",
    "submitter": "",
    "environment": "kaggle",
    "run_url": "https://github.com/ruslanmv/fitlab/actions/runs/38238711876"
  }
}