{
  "schema_version": "1.0",
  "model_id": "qwen2.5-7b-instruct",
  "ollama_tag": "qwen2.5:7b",
  "runtime": {
    "engine": "ollama",
    "version": "0.40.11"
  },
  "gpu": {
    "name": "Tesla T4",
    "vram_gb": 15.0,
    "driver": "580.178.04",
    "cuda": "",
    "profile_id": "t4-16"
  },
  "quant": "Q4_K_M",
  "context": 4096,
  "metrics": {
    "load_s": 74.98,
    "ttft_ms": 23.2,
    "prompt_tps": 2668.6,
    "gen_tps": 40.27,
    "gen_tps_runs": [
      13.76,
      40.79,
      40.27
    ],
    "peak_vram_gb": 6.37,
    "output_tokens": 768
  },
  "run": {
    "date": "2026-10-26",
    "prompt_id": "fitlab-v1-256",
    "repetitions": 3,
    "duration_s": 147.8
  },
  "provenance": {
    "source": "ci-kaggle",
    "submitter": "",
    "environment": "kaggle",
    "run_url": "https://github.com/ruslanmv/fitlab/actions/runs/40295619531"
  }
}