{
  "schema_version": "1.0",
  "model_id": "qwen3-06b",
  "ollama_tag": "qwen3:0.6b",
  "runtime": {
    "engine": "ollama",
    "version": "0.33.3"
  },
  "gpu": {
    "name": "cpu",
    "vram_gb": 0,
    "driver": "",
    "cuda": "",
    "profile_id": "cpu-only"
  },
  "quant": "Q4_K_M",
  "context": 4096,
  "metrics": {
    "load_s": 1.16,
    "ttft_ms": 27.7,
    "prompt_tps": 1549.9,
    "gen_tps": 34.84,
    "gen_tps_runs": [
      34.21,
      35.11,
      34.84
    ],
    "peak_vram_gb": 0.0,
    "output_tokens": 768
  },
  "run": {
    "date": "2026-09-07",
    "prompt_id": "fitlab-v1-256",
    "repetitions": 3,
    "duration_s": 32.4
  },
  "provenance": {
    "source": "ci-actions-cpu",
    "submitter": "ruslanmv",
    "environment": "actions",
    "run_url": "https://github.com/ruslanmv/fitlab/actions/runs/34099880521"
  }
}